{
  "schema_id": "idr.aegis.ingress-receipt-source-contract",
  "schema_version": 1,
  "contract_ref": "contract:aegis-ingress-receipt-source:synthetic-v1",
  "target_receipt_schema": {
    "schema_id": "idr.aegis.structured-observation",
    "schema_version": 1,
    "schema_path": "contracts/integrations/aegis-life/structured-observation/v1/idr-aegis-structured-observation-v1.schema.json",
    "schema_digest": "sha256:9fc11018249cc4053d4ddfa75e4eda6ae1f6638a592c115a05450249b2382b47",
    "receipt_definition": "IngressReceiptV1",
    "receipt_digest_domain": "idr:aegis:structured-observation-receipt:v1"
  },
  "source_review_pin": {
    "repository": "Aegis Life",
    "commit_sha": "381d14fb1dccfeae691286a39579535ef59f7b4e",
    "tree_sha": "da76b01653bb194e4f192e5768b32a38fd3b2173",
    "review_document": "docs/integrations/IDR-AEGIS-SOURCE-DATA-FLOW-REVIEW.md",
    "review_scope": "tracked_source_and_documentation_only"
  },
  "lifecycle": {
    "status": "SPECIFICATION_ONLY",
    "created_at_logical_time": 200,
    "valid_from_logical_time": 200,
    "valid_until_logical_time": 2000
  },
  "owner": {
    "owner_kind": "product_ingress_controller",
    "owner_ref": "component:aegis-ingress-controller",
    "atomic_acceptance_required": true,
    "delegation_allowed": false,
    "trust_state": "NOT_IMPLEMENTED",
    "reason_code": "NO_APPROVED_OWNER_OR_RECEIPT_SOURCE"
  },
  "identity_semantics": {
    "uuid_version": 4,
    "canonical_format": "lowercase_hyphenated",
    "mutually_distinct_fields": [
      "event_id",
      "run_id",
      "turn_id",
      "input_receipt_id"
    ],
    "collision_policy": "reject_and_regenerate_before_publish",
    "published_identity_mutation": "forbidden",
    "field_rules": [
      {
        "field": "event_id",
        "namespace": "aegis:event",
        "source": "cryptographic_uuid_v4_at_ingress",
        "cardinality": "one_per_accepted_event",
        "reuse_policy": "never",
        "missing_or_invalid": "REJECT_RECEIPT"
      },
      {
        "field": "run_id",
        "namespace": "aegis:run",
        "source": "typed_host_run_context",
        "cardinality": "one_per_host_run",
        "reuse_policy": "same_run_only",
        "missing_or_invalid": "REJECT_RECEIPT"
      },
      {
        "field": "turn_id",
        "namespace": "aegis:turn",
        "source": "typed_interaction_turn_context",
        "cardinality": "one_per_interaction_turn",
        "reuse_policy": "same_turn_only",
        "missing_or_invalid": "REJECT_RECEIPT"
      },
      {
        "field": "input_receipt_id",
        "namespace": "aegis:input-receipt",
        "source": "cryptographic_uuid_v4_at_receipt_seal",
        "cardinality": "one_per_sealed_receipt",
        "reuse_policy": "never",
        "missing_or_invalid": "REJECT_RECEIPT"
      }
    ]
  },
  "actor_semantics": {
    "source_actor_source": "authenticated_typed_origin",
    "source_actor_taxonomy_ref": "idr:v1.3:source-actor",
    "free_form_actor_classification": "forbidden",
    "actor_ref_source": "tenant_scoped_pseudonymization",
    "actor_ref_namespace": "aegis:actor",
    "direct_identifier_allowed": false,
    "unresolved_actor": "REJECT_RECEIPT"
  },
  "content_semantics": {
    "content_ref_source": "fresh_opaque_reference",
    "content_ref_namespace": "aegis:content",
    "url_or_path_reference_allowed": false,
    "content_digest_algorithm": "sha256",
    "digest_preimage": "exact_received_utf8_bytes",
    "digest_stage": "controller_boundary_before_downstream_processing",
    "unicode_normalization": "none",
    "raw_content_in_receipt": "forbidden",
    "raw_content_persistence": "not_authorized",
    "raw_content_export": "forbidden",
    "raw_content_telemetry": "forbidden",
    "hash_failure": "REJECT_RECEIPT"
  },
  "correlation_semantics": {
    "source": "authenticated_typed_upstream_context",
    "namespace": "aegis:correlation",
    "meaning": "nonsemantic_grouping_only",
    "fallback": "fresh_per_input_reference",
    "reuse_policy": "explicit_upstream_group_only",
    "goal_text_derivation": false,
    "semantic_similarity_derivation": false,
    "idr_output_derivation": false,
    "authority_semantics": "none"
  },
  "logical_time_semantics": {
    "clock_kind": "externally_injected_monotonic_logical_clock",
    "clock_ref": "clock:aegis-ingress-logical",
    "epoch_ref": "epoch:aegis-ingress-v1",
    "scope": "source_system",
    "sequence_rule": "strictly_increasing_per_source_system",
    "allocation_stage": "before_event_publish",
    "atomic_with_receipt_seal": true,
    "wall_clock_authoritative": false,
    "journal_time_authoritative": false,
    "trace_tick_authoritative": false,
    "rollback_rule": "reject_and_require_new_approved_epoch",
    "restart_rule": "restore_verified_anchor_or_reject",
    "exhaustion_rule": "reject_and_require_new_approved_epoch",
    "clock_failure": "REJECT_RECEIPT",
    "export_verification_clock": "separate_unresolved_gate"
  },
  "receipt_digest_semantics": {
    "algorithm": "sha256",
    "domain": "idr:aegis:structured-observation-receipt:v1",
    "delimiter": "nul_byte",
    "encoding": "utf8",
    "canonicalization": "canonical_json",
    "covered_fields": [
      "event_id",
      "run_id",
      "turn_id",
      "input_receipt_id",
      "source_actor",
      "actor_ref",
      "content_ref",
      "content_digest",
      "correlation_ref",
      "logical_time",
      "schema_version"
    ],
    "excluded_fields": [
      "receipt_digest"
    ]
  },
  "receipt_source_binding": {
    "schema_id": "idr.aegis.receipt-source-binding",
    "schema_version": 1,
    "status": "SPECIFIED_NOT_IMPLEMENTED",
    "required_fields": [
      "schema_id",
      "schema_version",
      "binding_ref",
      "receipt_digest",
      "source_contract_digest",
      "source_review_tree",
      "owner_ref",
      "clock_ref",
      "epoch_ref",
      "bound_at_logical_time",
      "binding_digest"
    ],
    "digest_domain": "idr:aegis:receipt-source-binding:v1",
    "creation_mode": "atomic_with_receipt_acceptance",
    "verification_stage": "before_fact_assertion_acceptance",
    "missing_or_mismatch": "REJECT_RECEIPT"
  },
  "implementation_gate": {
    "decision": "BLOCKED",
    "assessed_at_logical_time": 200,
    "checks": [
      {"check": "receipt_source_contract_locked", "status": "SATISFIED", "evidence_refs": ["spec:ingress-receipt-source-v1"]},
      {"check": "source_owner_approved", "status": "UNSATISFIED", "evidence_refs": []},
      {"check": "receipt_implementation_registered", "status": "UNSATISFIED", "evidence_refs": []},
      {"check": "ingress_path_wired", "status": "UNSATISFIED", "evidence_refs": []},
      {"check": "cryptographic_uuid_generation_verified", "status": "UNSATISFIED", "evidence_refs": []},
      {"check": "run_context_binding_verified", "status": "UNSATISFIED", "evidence_refs": []},
      {"check": "turn_context_binding_verified", "status": "UNSATISFIED", "evidence_refs": []},
      {"check": "actor_pseudonymization_verified", "status": "UNSATISFIED", "evidence_refs": []},
      {"check": "exact_content_digest_verified", "status": "UNSATISFIED", "evidence_refs": []},
      {"check": "correlation_semantics_verified", "status": "UNSATISFIED", "evidence_refs": []},
      {"check": "monotonic_clock_injection_verified", "status": "UNSATISFIED", "evidence_refs": []},
      {"check": "rollback_restart_recovery_verified", "status": "UNSATISFIED", "evidence_refs": []},
      {"check": "collision_and_atomicity_tested", "status": "UNSATISFIED", "evidence_refs": []},
      {"check": "receipt_source_binding_implemented", "status": "UNSATISFIED", "evidence_refs": []},
      {"check": "security_privacy_review_passed", "status": "UNSATISFIED", "evidence_refs": []},
      {"check": "cross_language_conformance_passed", "status": "UNSATISFIED", "evidence_refs": []}
    ],
    "decision_reason": "RECEIPT_SOURCE_NOT_IMPLEMENTED_OR_APPROVED",
    "gate_digest": "sha256:00f12a39accb27743141e577ac86d9cfcc6ac537f45ce7ed3a5532101b0ed792"
  },
  "contract_digest": "sha256:cb79455c5f0610dde99b5489da5761b6d9772189be3bb4a18e933fb5a44c467c"
}
